{
  "schema_version": "1.0",
  "kind": "ScenarioContract",
  "id": "SCN-NAC-H1-PRECOMPUTED-EMBEDDINGS",
  "version": "v1.1",
  "status": "ACTIVE",
  "scenario_class": "LOCAL_SANDBOX",
  "study_mode": "MECHANISM",
  "title": "NAC E-H1′ 预计算嵌入与原生信息条件判别沙箱",
  "problem_ref": {
    "id": "PRB-JOINT-ACTION-FORMATION",
    "version": "v2"
  },
  "participants": [
    {
      "entity_id": "ENT-RESEARCH-OWNER",
      "entity_type": "RESEARCH_PRINCIPAL",
      "principal": "研究用户",
      "authority_root": "本轮明确要求立即启动多条并行研究工作流",
      "authority_scope": "激活 LINE-01-NAC 与本地机制沙箱，但不授权机制结论晋升或现实动作"
    },
    {
      "entity_id": "ENT-NAC-H1-LOCAL-RUNTIME",
      "entity_type": "AGENT_EXECUTION_ENVIRONMENT",
      "principal": "用户授权的本地研究执行环境",
      "authority_root": "DEC-2026-07-28-ACTIVATE-NAC-H1-LINE",
      "authority_scope": "构造候选数据契约、评测器、强基线和反例；结果只进入研究候选区"
    }
  ],
  "initial_state": "Problem v2 与 LINE-01-NAC 已激活；三条并行工作流已完成 E0 输入门禁、数据审计与一手来源复核。首个 v1 沙箱错误要求各方案使用相同共享样本预算，尚未进入任何 batch；当前没有冻结的五模型 embedding receipt、可审计 gold labels 或可运行 E-H1′ 数据包。",
  "unknowns": [
    "公共锚点相对坐标在五种以上异构模型和最坏语言切片上能否达到同厂商 Recall@100 的 80%",
    "在允许各方案使用原生信息条件并统一核算完整资源后，vec2vec、Procrustes 或共享参考编码器是否完全覆盖 NAC",
    "真实与合成 Intent—画像数据是否足以形成独立于受测模型的 ground truth",
    "NAC 的多模型 onboarding 与版本成本优势是否足以补偿任何 Recall 损失"
  ],
  "allowed_actions": [
    "读取 LINE-01-NAC 白名单内的本地历史材料和公开一手来源",
    "构造并验证只消费预计算 embedding 的输入 manifest、evaluator 和合成回归夹具",
    "为各比较臂声明并哈希绑定原生信息条件与生命周期资源 receipt",
    "盘点可恢复的真实或合成 Intent—画像数据与标签来源",
    "保存失败、Unknown、反例、预算会计和不可支持结论"
  ],
  "prohibited_actions": [
    "接触真人参与者、私有账户、生产服务或付费资源",
    "把专利交底材料、私密参与者数据、凭据或完整私有档案发送给外部模型",
    "用合成夹具、工具测试或文献结果冒充 E-H1′ 已运行",
    "用 same-K 拒绝原生使用 unpaired corpus 的 vec2vec",
    "把 Recall 结果外推为授权、关系形成、Effect、Adoption 或 Acceptance",
    "自动把 MEC-NAC 改为 VALIDATED_SCOPED、REFUTED_SCOPED 或 REBASE_REQUIRED"
  ],
  "disclosure_boundary": "本地工作流可读取已白名单材料；任何外部检索只使用公开查询，任何模型外发必须经过冻结 disclosure manifest 且排除凭据、真人数据、专利原文和完整私有档案。",
  "cost_and_reversibility": {
    "cost_limit": "只运行本地 E0 工具验证与有界数据准备；不创建付费资源，不下载五模型大包，不执行生产调用。",
    "reversibility": "所有新产物位于本地研究候选、工具或测试目录；不修改原始档案和机制证据状态。",
    "stop_rule": "出现来源、隐私、预算或作用域越界立即停止；没有冻结输入时不得生成机制支持或反驳结论。"
  },
  "effect_witness": {
    "kind": "RESEARCH_ARTIFACT",
    "target_domain": "本地 NAC E-H1′ 研究候选区",
    "witness": "带输入哈希、模型有序对、切片、分母、原生信息条件和完整资源字段的 evaluator/manifest，以及通过的定向测试与来源核验",
    "success_observation": "研究装置能在真实运行前拒绝标签泄漏、模型对缺失、指标不可解释、信息条件未声明或资源账不完整的输入。",
    "failure_observation": "只产生模拟绿灯或平均 Recall，仍不能冻结 gold labels、模型 receipts、原生信息条件、强基线和完整资源账。"
  },
  "domain_adoption": {
    "authority": "本地候选研究区",
    "required_receipt": "文件 SHA-256、定向测试输出与 research governance 读回；这不是现实 Domain Adoption。"
  },
  "acceptance": {
    "authority": "研究用户",
    "required_evidence": "用户审阅并决定是否允许绑定真实或公开数据与五模型 receipt 开跑 E-H1′。"
  },
  "outcome_semantics": {
    "success": "形成可运行且能拒绝不可归因输入的 E-H1′ 研究装置，不表示 NAC 主张得到支持。",
    "failure": "现成方案已完整覆盖、数据无法形成可审计标签，或评测设计无法区分竞争解释。",
    "unknown": "装置成立但缺少真实数据、模型 receipt、基线实现或足够预算，保持机制证据状态不变。"
  },
  "strongest_credible_baseline": {
    "id": "BASE-NATIVE-CONDITIONS-AND-SHARED-ENCODER",
    "description": "stable Schema 加共享参考编码器、使用两侧 unpaired corpus 的 vec2vec，以及使用 correspondence 的 full-pair 或 hub Procrustes。",
    "fairness_requirements": [
      "所有方案使用相同 test labels、候选池、语言与关系切片和 Recall@100 定义",
      "每个方案声明并哈希绑定原生信息条件，不强制不适用的 same-K",
      "统一报告 corpus items、correspondences、encoder calls、训练与 seeds、存储传输、onboarding、adapter 或 mapping 数量、版本重算、双写和停机",
      "关键有序模型对与最坏切片失败不得被宏平均隐藏"
    ]
  },
  "activation": {
    "requires_user_approval": true,
    "approval_decision_id": "DEC-2026-07-28-ACTIVATE-NAC-H1-SCENARIO-V1-1"
  },
  "cannot_support": [
    "不能仅凭 evaluator、schema 或合成夹具证明 MC-NAC-ANCHOR",
    "不能测试或改变 H2–H8 与未受影响 scoped claims",
    "不能证明完整 Agent 关系、授权、现实效力或商业净价值",
    "不能自动修改 MEC-NAC 的正式证据或 adverse 状态"
  ],
  "source_refs": [
    "research/projects/joint-action-formation/lines/01-nac.json",
    "research/projects/joint-action-formation/studies/nac-h1-fairness-correction-2026-07-28.md",
    "research/projects/joint-action-formation/studies/nac-h1-data-and-labels-2026-07-28.md",
    "research/projects/joint-action-formation/prior-art/nac-h1-existing-solutions-2026-07-28.md",
    "research/contracts/nac-h1-embedding-manifest.schema.json",
    "tools/nac_h1_eval.py"
  ],
  "companion_markdown": "research/projects/joint-action-formation/scenarios/nac-h1-precomputed-embeddings-v1.1.md"
}
